0,1,2,3,4
778512,a little white boy that is laying down with a stuffed bear.,000000023746.jpg,coco/train2017,norm_mention
804551,a bald white man on a persian carpet with a glass of wine,000000075341.jpg,coco/train2017,norm_mention
483967,a black and a white woman standing under an umbrella,000000482590.jpg,coco/train2017,norm_mention
382840,a television that is on with a white man talking and campaign signs,000000408789.jpg,coco/train2017,norm_mention
299458,a white man with a beard wearing a white shirt and gold tie.,000000437459.jpg,coco/train2017,norm_mention
410277,a little white boy walking a big cow.,000000354242.jpg,coco/train2017,norm_mention
560606,a black and white picture of a white man singing a song,000000140087.jpg,coco/train2017,norm_mention
59124,an old white guy is happy that his first surfing adventure went well,000000205670.jpg,coco/train2017,norm_mention
598500,a white woman smiles at a large pizza in a box,000000565986.jpg,coco/train2017,norm_mention
615603,a white man holding a toothbrush and a tube of tooth paste,000000414212.jpg,coco/train2017,norm_mention
659515,a white kid with dreadlocks eating a large sandwich. ,000000112269.jpg,coco/train2017,norm_mention
42766,white people looking ridiculous playing wii and drinking beer.,000000217546.jpg,coco/train2017,norm_mention
168324,a very hairy white man celebrating with his wii remotes.,000000275755.jpg,coco/train2017,norm_mention
361732,a group of white people at a small party/gathering.,000000010966.jpg,coco/train2017,norm_mention
407537,a white woman with a blue shirt and a black skirt playing tennis ,000000409016.jpg,coco/train2017,norm_mention
418174,a white woman wearing a white hat and uniform,000000133620.jpg,coco/train2017,norm_mention
611557,a white woman sitting on a couch talking on her cellphone ,000000338384.jpg,coco/train2017,norm_mention
650451,two photos are presented white people talking on their phone.,000000341712.jpg,coco/train2017,norm_mention
427863,a white man holding a black and white dog ,000000355778.jpg,coco/train2017,norm_mention
461555,a red and white boy van made out of lego blocks.,000000453899.jpg,coco/train2017,norm_mention
610765,a white woman in a white top talking on her cellphone ,000000565091.jpg,coco/train2017,norm_mention
348051,a white man with chinese females in some office.,000000049408.jpg,coco/train2017,norm_mention
552774,a white girl laying down on a grey bench ,000000011256.jpg,coco/train2017,norm_mention
751206,the cute white woman sits alone on the bus.,000000372319.jpg,coco/train2017,norm_mention
439355,white man with gold chain and cell phone,000000258272.jpg,coco/train2017,norm_mention
804544,a happy white man with sunglasses on a boat. ,000000067802.jpg,coco/train2017,norm_mention
56537,a white man in a black suit looks at the camera.,000000381540.jpg,coco/train2017,norm_mention
659416,a black and white photograph of a white man with a large tie. ,000000071307.jpg,coco/train2017,norm_mention
8735,young white girl holding a suit case in a forest.,000000110547.jpg,coco/train2017,norm_mention
30972,black and white man walking down street with suitcase,000000249561.jpg,coco/train2017,norm_mention
281623,"a white guy in business attire and handkerchief in pocket, smiling",000000491999.jpg,coco/train2017,norm_mention
297669,a white woman and a man from india standing in front of a window.,000000012614.jpg,coco/train2017,norm_mention
383147,a white man in a suit holding papers,000000130540.jpg,coco/train2017,norm_mention
518044,a white man playing with an elephant outside,000000466797.jpg,coco/train2017,norm_mention
521763,an old white man with eye glasses holding a book,000000366500.jpg,coco/train2017,norm_mention
559217,two white men in ties are standing around talking.,000000095944.jpg,coco/train2017,norm_mention
576167,a white man standing in front of a building ,000000233644.jpg,coco/train2017,norm_mention
605618,two white people pet a large elephant on the trunk.,000000158020.jpg,coco/train2017,norm_mention
661882,black and white person standing with an umbrella,000000051862.jpg,coco/train2017,norm_mention
484010,a black and white man on a horse,000000511103.jpg,coco/train2017,norm_mention
410105,a blue and white woman holding a surfboard on top of a beach.,000000276017.jpg,coco/train2017,norm_mention
693720,a statue of a blue and white woman beside a blue and white surf board.,000000019388.jpg,coco/train2017,norm_mention
378058,a mature white woman sitting on a full size bed.,000000511676.jpg,coco/train2017,norm_mention
418192,a white man with a yellow and black uniform playing soccer,000000526968.jpg,coco/train2017,norm_mention
568858,a white woman in a white tennis outfit playing tennis,000000073786.jpg,coco/train2017,norm_mention
598594,a white woman dressed in pink plays professional tennis,000000114945.jpg,coco/train2017,norm_mention
289455,a white woman with a laptop and projector explain something to a group of black students,000000095455.jpg,coco/train2017,norm_mention
418053,a little white boy in a red shirt brushing his teeth,000000268835.jpg,coco/train2017,norm_mention
598493,a group of white women smiling on a couch,000000557483.jpg,coco/train2017,norm_mention
823352,staring white man has toothbrush in his mouth,000000318631.jpg,coco/train2017,norm_mention
309885,"two pictures side by side of a young white girl in a pink top, one holding a cell phone picture of her sibling, and the other with her sibling",000000018683.jpg,coco/train2017,norm_mention
398493,a white man with a goatee talking into a cell phone,000000227883.jpg,coco/train2017,norm_mention
501534,a white man drinking a drink and talking on his cell phone in a field.,000000188405.jpg,coco/train2017,norm_mention
621313,a little white boy standing in front of a steel fridge ,000000032513.jpg,coco/train2017,norm_mention
151753,older white people talk over dinner at party,000000409825.jpg,coco/train2017,norm_mention
